{
  "schemaVersion": 1,
  "kind": "tiger",
  "notes": "Approved shading transferred as RGB only; original geometry and alpha preserved; turret-shaped hull shadow excluded for rotation.",
  "inputs": {
    "hull": {
      "path": "source_art/tanks/tiger/shading-preview-20260909/installed-sources/hull.png",
      "background": "alpha"
    },
    "turret": {
      "path": "source_art/tanks/tiger/shading-preview-20260909/installed-sources/turret.png",
      "background": "alpha"
    },
    "destroyed": {
      "path": "source_art/tanks/tiger/shading-preview-20260909/installed-sources/destroyed.png",
      "background": "alpha"
    }
  },
  "processing": {
    "alphaThreshold": 32,
    "commonScale": 0.109,
    "outlinePixels": 0,
    "hullPadding": [
      1,
      1,
      1,
      1
    ],
    "turretPadding": [
      1,
      1,
      1,
      1
    ]
  },
  "sourceGeometry": {
    "hullPivot": [
      1160,
      386
    ],
    "turretPivot": [
      1160,
      386
    ],
    "muzzle": [
      69,
      386
    ],
    "commanderHatch": [
      1270,
      495
    ]
  }
}
