{
  "$schema": "./tank-art-manifest.schema.json",
  "schemaVersion": 1,
  "kind": "sherman_jumbo",
  "notes": "Jumbo simplified olive drab redraw; existing common geometry and silhouette retained; localized coarse wreck damage. See source_art/tanks/sherman_jumbo/simplified/README.md.",
  "inputs": {
    "hull": {
      "path": "source_art/tanks/sherman_jumbo/simplified/hull-source.png",
      "background": "alpha"
    },
    "turret": {
      "path": "source_art/tanks/sherman_jumbo/simplified/turret-source.png",
      "background": "alpha"
    },
    "destroyed": {
      "path": "source_art/tanks/sherman_jumbo/simplified/destroyed-source.png",
      "background": "alpha"
    }
  },
  "processing": {
    "alphaThreshold": 32,
    "commonScale": 1,
    "outlinePixels": 0,
    "hullPadding": [
      1,
      1,
      1,
      1
    ],
    "turretPadding": [
      1,
      1,
      1,
      1
    ]
  },
  "sourceGeometry": {
    "hullPivot": [
      65,
      33
    ],
    "turretPivot": [
      75,
      28
    ],
    "muzzle": [
      1,
      27
    ],
    "commanderHatch": [
      76,
      19
    ]
  }
}
