{
  "schemaVersion": 1,
  "kind": "tiger",
  "notes": "User-approved gun trace removal; exclude entire gun and turret illumination from hull; original alpha and geometry unchanged.",
  "inputs": {
    "hull": {
      "path": "source_art/tanks/tiger/gun-trace-fix-preview/hull.png",
      "background": "alpha"
    },
    "turret": {
      "path": "source_art/tanks/tiger/gun-trace-fix-preview/turret.png",
      "background": "alpha"
    },
    "destroyed": {
      "path": "source_art/tanks/tiger/gun-trace-fix-preview/destroyed.png",
      "background": "alpha"
    }
  },
  "processing": {
    "alphaThreshold": 32,
    "commonScale": 0.109,
    "outlinePixels": 0,
    "hullPadding": [
      1,
      1,
      1,
      1
    ],
    "turretPadding": [
      1,
      1,
      1,
      1
    ]
  },
  "sourceGeometry": {
    "hullPivot": [
      1160,
      386
    ],
    "turretPivot": [
      1160,
      386
    ],
    "muzzle": [
      69,
      386
    ],
    "commanderHatch": [
      1270,
      495
    ]
  }
}
