{
  "$schema": "./tank-art-manifest.schema.json",
  "schemaVersion": 1,
  "kind": "panzer3_m_no_schurzen",
  "notes": "Derived from approved grey Ausf. M sources. Only user-marked thin external rails and braces removed; original armor plates, track housings, deck, gun, cupola and wreck interior retained.",
  "inputs": {
    "hull": {
      "path": "source_art/tanks/panzer3_m/no-addon-armor/hull-selected.png",
      "background": "alpha"
    },
    "turret": {
      "path": "source_art/tanks/panzer3_m/no-addon-armor/turret-selected.png",
      "background": "alpha"
    },
    "destroyed": {
      "path": "source_art/tanks/panzer3_m/no-addon-armor/destroyed-selected.png",
      "background": "alpha"
    }
  },
  "processing": {
    "alphaThreshold": 32,
    "commonScale": 0.1,
    "outlinePixels": 0,
    "hullPadding": [
      1,
      1,
      1,
      1
    ],
    "turretPadding": [
      1,
      1,
      1,
      1
    ]
  },
  "sourceGeometry": {
    "hullPivot": [
      854,
      441
    ],
    "turretPivot": [
      944,
      469
    ],
    "muzzle": [
      27,
      469
    ],
    "commanderHatch": [
      1117,
      469
    ]
  }
}
